{
  "schema_version": 1,
  "catalog": "cmp89-green",
  "updated": "2026-08-08",
  "sources": {
    "cmp89": {
      "short": "Balaban CMP89",
      "title": "Regularity and Decay of Lattice Green's Functions",
      "author": "T. Balaban",
      "journal": "Communications in Mathematical Physics 89 (1983), 571-597",
      "doi": "10.1007/BF01214744",
      "web_urls": {
        "springer": "https://link.springer.com/article/10.1007/BF01214744",
        "project_euclid_html": "https://projecteuclid.org/journals/communications-in-mathematical-physics/volume-89/issue-4/Regularity-and-decay-of-lattice-Greens-functions/cmp/1103922931.full",
        "project_euclid_pdf": "https://projecteuclid.org/journals/communications-in-mathematical-physics/volume-89/issue-4/Regularity-and-decay-of-lattice-Greens-functions/cmp/1103922931.pdf",
        "project_euclid_legacy_pdf": "https://projecteuclid.org/download/pdf_1/euclid.cmp/1103922931"
      }
    },
    "cmp85_higgs_lower": {
      "short": "Balaban CMP85 Higgs lower bound",
      "title": "(Higgs)2,3 Quantum Fields in a Finite Volume. I. A Lower Bound",
      "author": "T. Balaban",
      "journal": "Communications in Mathematical Physics 85 (1982), 603-626",
      "doi": "10.1007/BF01403506",
      "web_urls": {
        "project_euclid_html": "https://projecteuclid.org/journals/communications-in-mathematical-physics/volume-85/issue-4/Higgs_23-quantum-fields-in-a-finite-volume-I-A-lower/cmp/1103921549.full",
        "project_euclid_pdf": "https://projecteuclid.org/journalArticle/Download?urlId=cmp%2F1103921549",
        "springer": "https://link.springer.com/article/10.1007/BF01403506"
      }
    },
    "cmp97_higgs_rg": {
      "short": "Balaban-Imbrie-Jaffe CMP97",
      "title": "Renormalization of the Higgs Model: Minimizers, Propagators and the Stability of Mean Field Theory",
      "author": "T. Balaban, J. Imbrie, A. Jaffe",
      "journal": "Communications in Mathematical Physics 97 (1985), 299-329",
      "doi": "10.1007/BF01206191",
      "web_urls": {
        "uva_primary_pdf": "https://uva.theopenscholar.com/files/john-imbrie/files/renormalizationhiggs.pdf"
      }
    },
    "cmp114_higgs_cluster": {
      "short": "Balaban-Imbrie-Jaffe CMP114",
      "title": "Effective Action and Cluster Properties of the Abelian Higgs Model",
      "author": "T. Balaban, J. Z. Imbrie, A. Jaffe",
      "journal": "Communications in Mathematical Physics 114 (1988), 257-315",
      "doi": "10.1007/BF01225038",
      "web_urls": {
        "uva_primary_pdf": "https://uva.theopenscholar.com/files/john-imbrie/files/effectiveaction.pdf"
      }
    }
  },
  "citations": [
    {
      "key": "cmp89.local-green.fourier.2.34-2.51",
      "source_id": "cmp89",
      "locator": {
        "printed_pages": "582-586",
        "pdf_pages": "12-16",
        "equations": ["2.34", "2.35", "2.36", "2.37", "2.42", "2.43", "2.44", "2.45", "2.46", "2.47", "2.48", "2.49", "2.50", "2.51"],
        "local_text": "private local extraction tmp/cmp89-primary-layout.txt; PDF SHA-256 416E2B1F00B52E7235AB27D2BE066B50D42DDE33CF8596BAEAE0A6688B145143",
        "renders": [
          "private local render tmp/cmp89-p-12.png",
          "private local render tmp/cmp89-p-13.png",
          "private local render tmp/cmp89-p-14.png",
          "private local render tmp/cmp89-p-15.png",
          "private local render tmp/cmp89-p-16.png",
          "private local 500-dpi render tmp/pdfs/cmp89-massdef-02.png",
          "private local 500-dpi renders tmp/pdfs/cmp89-eq251-hi-14.png through cmp89-eq251-hi-16.png"
        ],
        "web_urls": [
          "https://projecteuclid.org/download/pdf_1/euclid.cmp/1103922931",
          "https://link.springer.com/article/10.1007/BF01214744"
        ]
      },
      "status": "visual_confirmed",
      "summary": "CMP89 Lemma 2.4 proves the zero-background local Green value, derivative/Hölder and coarse-covariance decay estimates by an explicit Fourier representation, a uniform complex analytic strip and contour displacement; Lemma 2.2 and the later CMP95/CMP96 transports reduce to this source input. The real sinc-amplitude lower bound, its exact norm dictionary to (2.45), the central Laplacian ratio, the exact finite alias enumeration, the complete positive denominator estimate (2.50), the one-dimensional uniform p-series input of (2.51), its exact d-fold finite-product factorization, the expanded real geometry of every printed alias, explicit expanded-zone difference/sinc lower bounds, the periodic averaging-amplitude upper bound, the noncentral massive-symbol ratio under the explicit condition mass^2 <= 1, the literal Euclidean Hölder phase quotient, the exact noncentral redistribution to exponent 1+(1-alpha)/d, both the noncentral five-factor and central O(1) real integrand comparisons, their exact finite central/noncentral sum, the entire finite averaging amplitude with its exact printed-alias real-slice dictionary, the entire opposite-momentum Laplacian/averaging pairings, the literal complete complex alias denominator with exact real-slice dictionary, one common positive scalar strip radius, nonvanishing of the surviving noncentral fine symbols and stabilized denominator, pointwise holomorphy of the complete stabilized integrand on that strip, the physical Brillouin-face seam, compact-product integrability at every partial signed stage, the complete four-coordinate contour telescope for each stabilized endpoint separately, and their exact algebraic recombination are compiler verified. The exact lattice neighbour comparison exposes the multiplicative cost exp(rho), conditional on a named unit-edge displacement that the still-open owner dictionary must construct. Primary cross-source rescaling evidence classifies the mass condition: the dimensionless mass grows toward the unit lattice, while CMP89's j index runs in the opposite direction. Uniformity follows from a fixed physical-unit mass bound, equivalently a fine-lattice mass of order L^(-k); exact verification against the RG equation (2.43) in CMP85 remains open. The uniform integrand bound B0, physical owner-to-unit-edge dictionary and remaining Fourier estimates stay open.",
      "extracted_claims": [
        "Lemma 2.4, printed page 582, gives constants c0 and delta0 independent of the scale j for the exponential decay of G_j(Pi) Q_j^*, its first lattice derivative, its Holder difference, and C^(j)(Pi), on rectangular parallelepipeds built of large blocks.",
        "The proof first removes the boundary by the multiple-reflection representation (2.42), then writes the free Green explicitly by the Fourier transform (2.43)-(2.48).",
        "The denominator is bounded away from zero in (2.50), the momentum sum is uniformly summable in (2.51), and the integrand extends to a complex neighbourhood whose width and bound are uniform in j. Shifting the contour gives the exponential factor in (2.36); the remaining bounds follow by the same method.",
        "The first inequality in (2.50) retains only the zero alias from the finite sum; the other aliases enter this lower bound solely through nonnegativity, while their quantitative decay is used later in (2.51).",
        "Lemma 2.2 first treats a regular background as a small perturbation of a constant background, gauges the constant background to zero, and reduces its local regularity bounds to Lemma 2.4 through the renormalization identity (2.34).",
        "The argument is internal to CMP89 at this point: the zero-background local decay is not deferred to another paper and is not obtained from a reciprocal-coercivity Combes-Thomas estimate.",
        "Equations (2.44)-(2.51), visually checked on printed pages 584-586, use the scale-indexed quantity m_j^2; the action displayed at the start of Section 3 uses m_k^2. These pages do not state the cross-scale law for that family.",
        "CMP97 printed page 300 displays the unit-lattice scalar mass coefficient as (m^2 + delta m^2) epsilon^2, so the dimensionless mass at lattice spacing a is proportional to the physical mass times a.",
        "CMP114 printed page 273 states that after n RG transformations the unit lattice represents spacing L^n epsilon, with the process stopped when L^n epsilon reaches a fixed physical length. With CMP89 eta=L^(-k) and its intermediate lattice xi=L^(-j), n=k-j and hence m_j=L^(k-j)m_k for the dimensionless mass, or m_j=m_phys L^(-j).",
        "Thus m_j increases along forward coarse graining (n increases, CMP89 j decreases), but remains bounded by the unit-scale physical mass. The condition m_j^2 <= 1 for every 0 <= j <= k follows from m_phys^2 <= 1, equivalently m_k^2 <= L^(-2k). This is a physical normalization/bare-mass scaling law, not a freely chosen sixteenth smallness window.",
        "CMP89 (2.44) defines the full-lattice inverse operator as -Delta^xi + m_j^2 + a_j Q_j^*Q_j. In (2.50) the central alias from the block-averaging term yields a_j |u_j(p)|^2 Delta^1(p)/Delta^xi(p) >= O(1) > 0. The scale-uniform denominator gap is therefore supplied by the averaging penalty rather than by the running mass.",
        "The free-boundary box is reduced to the full lattice by the multiple-reflection formula (2.42); boundary geometry transports the full-lattice decay and is not its spectral-gap source.",
        "Immediately after (2.51), CMP89 states that the analytic neighbourhood of [-pi,pi]^d and the integrand bound can both be chosen independently of j. Shifting the contour inside it produces exp(-delta0 distance). Thus one quantitative strip proof produces the zero-background decay rate and prefactor later consumed as delta0 and B0, although delta0 is a chosen shift inside the strip rather than definitionally its maximal radius.",